Product Name,Comment
iPhone 15,"Captures stunningly detailed photos, but battery life could be better."
Samsung Galaxy S23,Blazing-fast performance makes multitasking a breeze.
Sony PlayStation 5,"Immersive gaming experience thanks to incredible graphics, but finding one in stock can be a challenge."
Nintendo Switch OLED,"Perfect for on-the-go gaming with its vibrant display, but Joy-Con controllers prone to drift issues."
Bose QuietComfort 35 II headphones,"Superior noise cancellation makes travel enjoyable, but bulky design not ideal for workouts."
Instant Pot Duo Nova 7-in-1 Pressure Cooker,"Convenient cooking with endless recipe possibilities, but inner pot scratches easily if not handled carefully."
Dyson V11 Absolute vacuum cleaner,"Powerful suction tackles carpets and floors effortlessly, but comes at a premium price."
Fitbit Charge 5 fitness tracker,"Tracks activity and sleep well with a stylish design, but battery life could be longer."
Kindle Paperwhite e-reader,"Comfortable reading experience for hours with a vast book selection, but limited features compared to tablets."
Nespresso Vertuo Next coffee machine,"Makes delicious coffee easily with various pod options, but pods can be expensive and create waste."
MacBook Air M2,"Thin and light with powerful performance, but screen resolution not as high as Pro models."
Google Pixel 7 Pro,"Outstanding camera and clean software experience, but battery life average compared to competitors."
Microsoft Surface Laptop Studio,"Versatile design perfect for creative work, but expensive and heavier than traditional laptops."
Apple Watch Series 8,"Comprehensive health tracking and seamless integration with iPhone, but pricey and battery life could be better."
Samsung Galaxy Tab S8 Ultra,"Large, beautiful display ideal for productivity and entertainment, but heavy and expensive."
Bose SoundLink Revolve+ Bluetooth speaker,"360-degree sound excellent for outdoor use, but battery life not as long as some competitors."
Sony WH-1000XM5 noise-canceling headphones,"Superb noise cancellation and comfortable fit, but pricey and sensitive to hot weather."
Instant Pot Smart Pot Pro Plus,"Versatile appliance that cooks numerous dishes well, but can be bulky and take up counter space."
Dyson Omni Glide robotic vacuum cleaner,"Effortless cleaning and automatically avoids obstacles, but expensive and not as powerful as some competitors."
Fitbit Sense 2 smartwatch,"Advanced health tracking features and stress management tools, but pricey and battery life not as long as some competitors."
Kindle Oasis e-reader,"Adjustable warm light for a comfortable reading experience, but expensive and not as portable as Paperwhite."
Nespresso Vertuo Next Deluxe coffee machine,"Makes delicious coffee easily with various pod options, but pods expensive and create waste."
Sony Xperia 1 IV smartphone,"Excellent camera and powerful performance, but expensive and lacks some features of competitors."
Samsung Galaxy Z Fold 4 foldable phone,"Innovative design with a large display when unfolded, but expensive and prone to scratches."
Microsoft Surface Pro 8,"Powerful tablet with laptop capabilities, great for productivity, but expensive and bulky compared to traditional laptops."
Apple AirPods Pro (2nd generation),"Improved noise cancellation and better fit than originals, but battery life not as long as some competitors."
Samsung Galaxy Buds Pro 2,"Excellent sound quality and good noise cancellation, but fit not as secure as some competitors."
LG C2 OLED TV,"Stunning picture quality perfect for watching movies and shows, but pricey and susceptible to burn-in."
Samsung Odyssey G9 gaming monitor,"Huge curved display for an immersive gaming experience, but expensive and takes up a lot of desk space."
Shark IQ Robot Self-Empty XL R101AE robot vacuum cleaner,"Automatically empties dustbin, good for pet owners, but can be loud and not as powerful as some competitors."
Braun Series 9 electric shaver,"Close, comfortable shave and easy to clean, but pricey and requires regular replacement of shaving head."
Philips Sonicare 9900 Prestige electric toothbrush,"Advanced cleaning technology and personalized brushing experience, but expensive and requires regular replacement of brush head."
Ninja Foodi Multicooker,"Versatile appliance that cooks numerous dishes quickly and easily, but can be bulky and difficult to clean."
Breville Barista Express espresso machine,"Makes excellent espresso at home and easy to use, but expensive and takes up counter space."
NutriBullet Pro blender,"Powerful blending performance, easy to use and clean, but can be loud."
